{
  "$schema": "https://json-schema.org/draft/2020-12/schema",
  "$id": "https://vehiclerecon.local/schemas/cage_v2.schema.json",
  "type": "object",
  "properties": {
    "schema_version": {
      "const": 2
    },
    "collection": {
      "type": "string",
      "minLength": 1
    },
    "curves": {
      "type": "array",
      "items": {
        "type": "object",
        "properties": {
          "id": {
            "type": "string",
            "minLength": 1
          },
          "role": {
            "type": "string",
            "minLength": 1
          },
          "kind": {
            "enum": [
              "rail",
              "section",
              "wheel",
              "arch"
            ]
          },
          "points": {
            "type": "array",
            "items": {
              "oneOf": [
                {
                  "type": "array",
                  "items": {
                    "type": "number"
                  },
                  "minItems": 3,
                  "maxItems": 3
                },
                {
                  "type": "object",
                  "properties": {
                    "landmark": {
                      "type": "string",
                      "pattern": "^[A-Za-z_][A-Za-z0-9_.:-]*$",
                      "maxLength": 160
                    }
                  },
                  "required": [
                    "landmark"
                  ],
                  "additionalProperties": false
                }
              ]
            },
            "minItems": 2
          },
          "symmetry": {
            "type": "boolean"
          },
          "cyclic": {
            "type": "boolean"
          },
          "material": {
            "type": "string",
            "minLength": 1
          },
          "radius": {
            "type": "number",
            "exclusiveMinimum": 0
          },
          "handles": {
            "enum": [
              "AUTO",
              "VECTOR"
            ]
          },
          "landmark": {
            "type": "string",
            "minLength": 1
          },
          "point_ids": {
            "type": "array",
            "items": {
              "type": "string",
              "pattern": "^[A-Za-z_][A-Za-z0-9_.:-]*$",
              "maxLength": 160
            },
            "minItems": 2,
            "maxItems": 100000
          },
          "visibility": {
            "enum": [
              "visible",
              "inferred"
            ]
          }
        },
        "required": [
          "id",
          "role",
          "kind",
          "points",
          "symmetry",
          "cyclic",
          "material",
          "radius",
          "handles",
          "point_ids",
          "visibility"
        ],
        "additionalProperties": false
      }
    },
    "landmarks": {
      "type": "object",
      "additionalProperties": {
        "type": "array",
        "items": {
          "type": "number"
        },
        "minItems": 3,
        "maxItems": 3
      }
    },
    "sides": {
      "type": "array",
      "items": {
        "type": "array",
        "prefixItems": [
          {
            "type": "string"
          },
          {
            "enum": [
              -1,
              1
            ]
          }
        ],
        "items": false,
        "minItems": 2,
        "maxItems": 2
      }
    },
    "materials": {
      "type": "array",
      "items": {
        "type": "object",
        "properties": {
          "name": {
            "type": "string"
          },
          "kind": {
            "const": "emission"
          },
          "color": {
            "type": "array",
            "items": {
              "type": "number"
            },
            "minItems": 3,
            "maxItems": 3
          }
        },
        "required": [
          "name",
          "kind",
          "color"
        ],
        "additionalProperties": false
      }
    },
    "guides": {
      "type": "array",
      "items": {
        "type": "object",
        "properties": {
          "kind": {
            "enum": [
              "wheel",
              "arch"
            ]
          },
          "name": {
            "type": "string"
          },
          "axles": {
            "type": "array",
            "items": {
              "type": "string"
            }
          },
          "segments": {
            "type": "integer",
            "minimum": 3
          },
          "radius_m": {
            "type": "number",
            "exclusiveMinimum": 0
          },
          "half_width_m": {
            "type": "number"
          },
          "width_crown_m": {
            "type": "number"
          },
          "angles_deg": {
            "type": "array",
            "items": {
              "type": "number"
            }
          },
          "material": {
            "type": "string"
          },
          "radius": {
            "type": "number",
            "exclusiveMinimum": 0
          }
        },
        "required": [
          "kind",
          "name",
          "axles",
          "material",
          "radius"
        ],
        "additionalProperties": false
      }
    },
    "renders": {
      "type": "array",
      "items": {
        "type": "object",
        "properties": {
          "view": {
            "type": "string"
          },
          "camera": {
            "type": "string"
          },
          "reference": {
            "type": [
              "string",
              "null"
            ]
          },
          "size": {
            "type": "array",
            "items": {
              "type": "integer",
              "minimum": 1
            },
            "minItems": 2,
            "maxItems": 2
          }
        },
        "required": [
          "view",
          "camera",
          "reference",
          "size"
        ],
        "additionalProperties": false
      }
    }
  },
  "required": [
    "schema_version",
    "collection",
    "curves",
    "landmarks",
    "sides",
    "materials",
    "guides",
    "renders"
  ],
  "additionalProperties": false
}
